{
  "$schema": "https://json-schema.org/draft/2020-12/schema",
  "$id": "https://raw.githubusercontent.com/ForjSkript/ForgeExtensions/refs/heads/main/extensions/$schema.json",
  "title": "ForgeScript Extension Metadata",
  "type": "object",
  "required": ["id", "package", "github"],
  "additionalProperties": false,

  "properties": {
    "$schema": {
      "type": "string",
      "format": "uri"
    },

    "id": {
      "type": "string",
      "minLength": 1
    },

    "package": {
      "type": "object",
      "required": ["name", "description", "type", "author"],
      "additionalProperties": false,

      "properties": {
        "name": {
          "type": "string",
          "minLength": 1
        },
        "description": {
          "type": "string",
          "minLength": 1
        },
        "type": {
          "type": "integer",
          "enum": [0, 1, 2],
          "description": "0 = official, 1 = community, 2 = unlisted"
        },
        "author": {
          "$ref": "#/$defs/person"
        },
        "leadDeveloper": {
          "$ref": "#/$defs/person"
        }
      }
    },

    "github": {
      "type": "object",
      "required": ["owner", "repo", "defaultBranch", "branches"],
      "additionalProperties": false,
      "properties": {
        "owner": {
          "type": "string",
          "minLength": 1
        },
        "repo": {
          "type": "string",
          "minLength": 1
        },
        "defaultBranch": {
          "type": "string",
          "minLength": 1
        },
        "branches": {
          "type": "array",
          "items": {
            "type": "string",
            "minLength": 1
          },
          "minItems": 1,
          "uniqueItems": true
        }
      }
    },

    "links": {
      "type": "object",
      "additionalProperties": false,
      "properties": {
        "documentation": {
          "type": "string",
          "format": "uri"
        },
        "npm": {
          "type": "string",
          "format": "uri"
        }
      }
    }
  },

  "$defs": {
    "person": {
      "type": "object",
      "required": ["name", "avatar"],
      "additionalProperties": false,
      "properties": {
        "name": {
          "type": "string",
          "minLength": 1
        },
        "avatar": {
          "type": "string",
          "format": "uri"
        },
        "discord": {
          "type": "string"
        }
      }
    }
  }
}
