{
  "$schema": "https://raw.githubusercontent.com/ForjSkript/ForgeExtensions/refs/heads/main/extensions/$schema.json",
  "id": "forge-embeds",
  "package": {
    "name": "ForgeEmbeds",
    "description": "A powerful ForgeScript extension for creating rich Discord messages using the BKV (Bracket Key-Value) format. Supports both Normal Embeds and the modern Components V2 layout.",
    "type": 2,
    "author": {
      "name": "Zack",
      "avatar": "https://docs.botforge.org/avatars/zack_68d05b1c0e6cb4.37697872.jpg"
    }
  },
  "github": {
    "owner": "Zack-911",
    "repo": "ForgeEmbeds",
    "branches": [
      "main"
    ],
    "defaultBranch": "main"
  },
  "links": {}
}
